{
  "version": "1.0",
  "pii_removed": true,
  "subscores": {
    "structure": {
      "score": 82,
      "rationale": "教育/工作/项目/技能版块齐全",
      "source_spans": [
        {
          "doc": "resume",
          "quote": "教育经历",
          "start": 98,
          "end": 102
        }
      ]
    },
    "clarity": {
      "score": 78,
      "rationale": "推动团队引入规范，体现协作意识",
      "source_spans": [
        {
          "doc": "resume",
          "quote": "推动团队引入 ESLint + Prettier 统一代码规范，代码审查通过率提升 40%",
          "start": 305,
          "end": 350
        }
      ]
    },
    "achievement_evidence": {
      "score": 72,
      "rationale": "三处量化成果，口径清晰",
      "source_spans": [
        {
          "doc": "resume",
          "quote": "将商品详情页首屏加载时间从 3.2s 优化到 1.1s，通过路由懒加载和图片懒加载实现",
          "start": 261,
          "end": 304
        }
      ]
    },
    "skill_evidence": {
      "score": 75,
      "rationale": "React 生态技能匹配度高",
      "source_spans": [
        {
          "doc": "resume",
          "quote": "语言：JavaScript（熟练）、TypeScript（熟练）、HTML/CSS（熟练）",
          "start": 494,
          "end": 539
        }
      ]
    },
    "ats_readability": {
      "score": 85,
      "rationale": "纯文本结构清晰",
      "source_spans": [
        {
          "doc": "resume",
          "quote": "技能清单",
          "start": 489,
          "end": 493
        }
      ]
    }
  },
  "suggestions": [
    {
      "id": "S1",
      "severity": "P1",
      "issue": "项目经历缺少团队规模说明",
      "suggestion": "补充协作白板项目的团队规模或独立开发标注",
      "rewrite_draft": "独立开发在线协作白板（1 人），支持多人实时协同编辑",
      "source_spans": [
        {
          "doc": "resume",
          "quote": "基于 React + Konva.js 实现 Canvas 实时绘制，支持多人协同编辑",
          "start": 386,
          "end": 429
        }
      ]
    },
    {
      "id": "S2",
      "severity": "P2",
      "issue": "Vue3 标注为了解但未展开具体实践",
      "suggestion": "如有 Vue 项目经验则补充具体场景，否则保持诚实标注",
      "rewrite_draft": "Vue3：阅读官方文档并完成 TodoMVC 练习项目",
      "source_spans": [
        {
          "doc": "resume",
          "quote": "框架：React、Next.js、Vue3（了解）",
          "start": 540,
          "end": 565
        }
      ]
    }
  ]
}
